node_1|node_2|edge|chunk_id
timeoutdefer|requestfn|assigned when 'immediate' is set and the browser doesn't have native support for window.requestAnimationFrame|13bfb230771f449a88c65623de5adb90|
cancelanimframe|id|cancels a previous requestAnimFrame when provided with an ID|13bfb230771f449a88c65623de5adb90|
cancelfn|window|called to cancel a previously scheduled animation frame|13bfb230771f449a88c65623de5adb90|
class|l.class|both terms refer to the same concept, a JavaScript class definition|2e4373b1b9424cf2bf83fa0a920d6c47|
class|extend|the 'extend' function is used within the 'Class' constructor to add properties and methods to a class|2e4373b1b9424cf2bf83fa0a920d6c47|
function|extend|the 'extend' function returns a JavaScript function, which is also referred to as a 'class constructor'|2e4373b1b9424cf2bf83fa0a920d6c47|
newclass|function|the 'NewClass' variable is assigned the value of a new function created using the 'function' keyword|2e4373b1b9424cf2bf83fa0a920d6c47|
this.initialize|newclass|the 'initialize' property of the current object (i.e., 'this') is called within the constructor function for 'NewClass'|2e4373b1b9424cf2bf83fa0a920d6c47|
this.callinithooks|newclass|the 'callInitHooks' method is defined on the prototype of 'NewClass' and is called to execute initialization hooks|2e4373b1b9424cf2bf83fa0a920d6c47|
parentproto|newclass.prototype|the 'parentProto' variable refers to the prototype property of the 'NewClass' constructor|2e4373b1b9424cf2bf83fa0a920d6c47|
proto|an object created using the 'create' function and used as the new prototype for 'newclass'|the 'proto' variable is assigned a new object created using the 'create' function|2e4373b1b9424cf2bf83fa0a920d6c47|
constructor|newclass.prototype|the 'constructor' property is added to the prototype of 'NewClass'|2e4373b1b9424cf2bf83fa0a920d6c47|
props.options|class.prototype.options|the 'options' property from the given 'props' object is merged with the 'options' property on the prototype of 'Class'|2e4373b1b9424cf2bf83fa0a920d6c47|
checkdeprecatedmixinevents|undefined|the 'checkDeprecatedMixinEvents' function is called within the 'extend' method, but it is undefined|2e4373b1b9424cf2bf83fa0a920d6c47|
class|include|is a method added to the prototype object of a class using the include function, which mixes in the properties and methods defined in another object into the current class.|2251538aa6b14228950c8a595448aa26|
class|mergeoptions|is a method added to the prototype object of a class using the mergeOptions function, which merges the options passed as an argument with the default options of the class.|2251538aa6b14228950c8a595448aa26|
class|addinithook|is a method added to the prototype object of a class using the addInitHook function, which adds a constructor hook as a function or string followed by its arguments to be executed during the initialization process of an instance of the class.|2251538aa6b14228950c8a595448aa26|
class|proto._inithooks|is an array property of the Class prototype object, which stores all the constructor hooks added using the addInitHook function during initialization process of a new instance of the class.|2251538aa6b14228950c8a595448aa26|
class|_inithookscalled|is a boolean property used to prevent calling of init hooks multiple times during the construction process of an instance of the class.|2251538aa6b14228950c8a595448aa26|
context|proto._inithooks = [];|initializes an empty array called proto._initHooks for storing constructor hooks during the initialization process of a new instance of the class.|2251538aa6b14228950c8a595448aa26|
context|proto.callinithooks = function () { |defines a method called callInitHooks for initializing all the constructor hooks added using the addInitHook function during initialization process of a new instance of the class.|2251538aa6b14228950c8a595448aa26|
context|parentproto.callinithooks|initializes the parent class's callInitHooks method, if it exists, during initialization process of a new instance of the current class.|2251538aa6b14228950c8a595448aa26|
context|_inithookscalled = true; |sets a boolean flag called _initHooksCalled to true after executing all the constructor hooks during initialization process of a new instance of the class.|2251538aa6b14228950c8a595448aa26|
context|l.mixin|checks for the existence of Mixin object from L library, which is used in the include function for mixing in properties and methods into the current class.|2251538aa6b14228950c8a595448aa26|
context|isarray(includes)|converts a value passed as argument to the includes function into an array, if it is not already an array.|2251538aa6b14228950c8a595448aa26|
events|l.mixin.events|Deprecated include of L.Mixin.Events.|5bd7adc572e64302a3dfbd78776a9ca3|
evented|l.evented|A set of methods shared between event-powered classes.|5bd7adc572e64302a3dfbd78776a9ca3|
this|evented|is a type of that is used in the context to add event parents. This allows for propagated events to be received by other Evented objects.|c9b6de9176884144a4e8ac14c986249e|
propagate|_eventparents|is a property of this object that is checked when an event is propagated. If the event propagates, this property is used to check if any event parents listen for the specific event and type.|c9b6de9176884144a4e8ac14c986249e|
id|_eventparents|is a property of this object that is used to store references to event parents. Each reference is assigned a unique identifier, which allows for multiple event parents to be added without causing conflicts.|c9b6de9176884144a4e8ac14c986249e|
handler|_eventparents|is a function that is added as a listener when the 'once' method is called. This function ensures that the event and its listeners are removed after it has been fired once.|c9b6de9176884144a4e8ac14c986249e|
type|_eventparents|is a property of this object that is used to specify the type of event being listened for. This allows for more specific event handling and prevents conflicts between multiple listeners with overlapping event types.|c9b6de9176884144a4e8ac14c986249e|
types|once|is an object that can be passed to the 'once' method to specify multiple types of events to listen for. This allows for more complex event handling with multiple types of events.|c9b6de9176884144a4e8ac14c986249e|
_eventparents|on|is a function called when an event is fired on this object. If the event propagates, this function is used to check if any event parents are listening for the specific event and type.|c9b6de9176884144a4e8ac14c986249e|
obj|addeventparent|is a parameter passed to the 'addEventParent' method. This allows for multiple event parents to be added, which can help with more complex event handling.|c9b6de9176884144a4e8ac14c986249e|
_eventparents|removeeventparent|is a property of this object that is used to remove an event parent from the list of event parents. This allows for more specific and targeted event handling.|c9b6de9176884144a4e8ac14c986249e|
_eventparents|_propagateevent|is a function called when an event is propagated on this object. This function loops through the list of event parents and fires the event for each one.|c9b6de9176884144a4e8ac14c986249e|
addeventlistener|on|Alias relationship between 'addEventListener' and 'on'|9f00313632f04298a95b6a0ba9e38c10|
addeventlistener|addeventlistener|Both are methods of the same class|9f00313632f04298a95b6a0ba9e38c10|
removeeventlistener|clearalleventlisteners|Alias relationship between 'removeEventListener' and 'clearAllEventListeners'|9f00313632f04298a95b6a0ba9e38c10|
removeeventlistener|off|Alias relationship between 'removeEventListener' and 'off'|9f00313632f04298a95b6a0ba9e38c10|
addonetimeeventlistener|once|Alias relationship between 'addOneTimeEventListener' and 'once'|9f00313632f04298a95b6a0ba9e38c10|
fireevent|fire|Alias relationship between 'fireEvent' and 'fire'|9f00313632f04298a95b6a0ba9e38c10|
point|[x, y]|Both represent a point with x and y coordinates in pixels|9f00313632f04298a95b6a0ba9e38c10|
point|number|In the constructor Point(x, y, round), x and y are passed as arguments of type Number, which are then assigned to their respective properties in two different ways based on a boolean flag.|68005789e5624a81be2ed2ac40f8081a|
point|point|The clone() method returns a new Point object with the same coordinates as the current one.|68005789e5624a81be2ed2ac40f8081a|
point|point|The add(otherPoint) method returns a new Point object which is obtained by adding the current Point to another Point (passed as argument).|68005789e5624a81be2ed2ac40f8081a|
topoint|point|In the add() method, the argument 'otherPoint' is converted to a Point object using the helper function toPoint(). This conversion is necessary because the type of 'otherPoint' is not guaranteed.|68005789e5624a81be2ed2ac40f8081a|
point|number|The _add(point) method adds the coordinates (x and y) of the given Point object to the current Point's coordinates. This method is called internally by the add() method for performance reasons.|68005789e5624a81be2ed2ac40f8081a|
point|point|The subtract(otherPoint) method returns a new Point object which is obtained by subtracting another Point (passed as argument) from the current one.|68005789e5624a81be2ed2ac40f8081a|
topoint|point|The argument 'otherPoint' of the subtract() method is converted to a Point object using the helper function toPoint(). This conversion is necessary for type compatibility.|68005789e5624a81be2ed2ac40f8081a|
point|number|The _subtract(point) method subtracts the coordinates (x and y) of the given Point object from the current Point's coordinates. This method is called internally by the subtract() method for performance reasons.|68005789e5624a81be2ed2ac40f8081a|
point|number|The divideBy(num) method returns a new Point object which is obtained by dividing all its coordinates (x and y) with the given number. This division is performed internally by the _divideBy(num) method.|68005789e5624a81be2ed2ac40f8081a|
multiplyby|num|Is called with a number argument, multiplies each coordinate of the point by that number.|3302bb192a75492ab2f5f1696449d5e3|
_divideby|num|Divides each coordinate of the point by the given number.|3302bb192a75492ab2f5f1696449d5e3|
_multiplyby|num|Multiplies the point by a scaling matrix defined by the given number.|3302bb192a75492ab2f5f1696449d5e3|
scaleby|point|Multiplies each coordinate of the current point by each coordinate of the given point.|3302bb192a75492ab2f5f1696449d5e3|
_round|this.x, this.y|Returns a copy of the point with rounded coordinates.|3302bb192a75492ab2f5f1696449d5e3|
_floor|this.x, this.y|Returns a copy of the point with floored coordinates (rounded down).|3302bb192a75492ab2f5f1696449d5e3|
distanceto|point|This method takes another point as an argument and returns the cartesian distance between the current and the given points.|10d9074a783847898392b0820de56fee|
topoint|point|This method is used to convert a non-point value to Point object. It takes a point as an argument and returns a clone of it.|10d9074a783847898392b0820de56fee|
_floor|this|This method returns a copy of the current point with floor coordinates (rounded down).|10d9074a783847898392b0820de56fee|
_ceil|this|This method returns a copy of the current point with ceiled coordinates (rounded up).|10d9074a783847898392b0820de56fee|
_trunc|this|This method returns a copy of the current point with truncated coordinates (rounded towards zero).|10d9074a783847898392b0820de56fee|
equals|point|This method returns true if the given point has the same coordinates as the current point.|10d9074a783847898392b0820de56fee|
contains|point|This method returns true if both coordinates of the given point are less than or equal to the corresponding coordinates of the current point in absolute values.|10d9074a783847898392b0820de56fee|
point|x|The first argument 'x' passed to the constructor Point(x, y) represents the x-coordinate of a point.|5687000f919d427f930a8f6c5df759c3|
point|y|The second argument 'y' passed to the constructor Point(x, y) represents the y-coordinate of a point.|5687000f919d427f930a8f6c5df759c3|
point|round|Optional parameter 'round' when creating a Point object. If true, rounds the x and y coordinates.|5687000f919d427f930a8f6c5df759c3|
l|point|Factory function L.point() creates a Point object with given x and y coordinates or an array representing those coordinates, or a plain object containing x and y properties.|5687000f919d427f930a8f6c5df759c3|
array|point|Alternative factory function L.point(coords: Number[]) accepts an array of the form [x, y] representing a Point object's coordinates.|5687000f919d427f930a8f6c5df759c3|
object|point|Alternative factory function L.point(coords: Object) accepts a plain object with properties x and y representing the coordinates of a Point object.|5687000f919d427f930a8f6c5df759c3|
bounds|point|a constructor of Bounds class takes Point as an argument and extends the bounds to contain the given point.|be8f0fa9b5a34923ae3bee1ec88ae716|
min|max|min and max are properties of Bounds class which represent the top left corner and bottom right corner of the rectangle respectively.|be8f0fa9b5a34923ae3bee1ec88ae716|
getcenter|point|Returns the center point of the bounds, where bounds represents a Rectangle or a Polygon object. The method accepts an optional boolean argument round, which specifies whether to round the coordinates to integers.|9d90e15a69384256b4f8a7a3a819aa6c|
getcenter|bounds|The `getCenter` method takes a `bounds` object as its input and returns the center point of those bounds.|9d90e15a69384256b4f8a7a3a819aa6c|
point|min|The `Point` class in this context has an attribute called `min`. This is the bottom-left corner point of a rectangle or polygon.|9d90e15a69384256b4f8a7a3a819aa6c|
point|max|The `Point` class also has an attribute called `max`. This is the top-right corner point of a rectangle or polygon.|9d90e15a69384256b4f8a7a3a819aa6c|
bounds|min|The `min` property in the `Bounds` object represents the bottom-left corner point of the bounds.|9d90e15a69384256b4f8a7a3a819aa6c|
bounds|max|Similarly, the `max` property in the `Bounds` object represents the top-right corner point of the bounds.|9d90e15a69384256b4f8a7a3a819aa6c|
contains|otherbounds|The `contains` method of a `Bounds` object takes another `Bounds` object as input and returns true if this rectangle contains the given one, false otherwise.|9d90e15a69384256b4f8a7a3a819aa6c|
contains|point|The `contains` method of a `Bounds` object also takes a single point as input and returns true if this rectangle contains that point, false otherwise.|9d90e15a69384256b4f8a7a3a819aa6c|
bounds|obj|if (obj instanceof Bounds) {|7f5a269b7e174256b2752ec84ba5fd4c|
min|bounds|if (obj instanceof Bounds) {|7f5a269b7e174256b2752ec84ba5fd4c|
max|bounds|if (obj instanceof Bounds) {|7f5a269b7e174256b2752ec84ba5fd4c|
min|max|else {|7f5a269b7e174256b2752ec84ba5fd4c|
min.x|bounds|if (obj instanceof Bounds) {|7f5a269b7e174256b2752ec84ba5fd4c|
max.x|bounds|if (obj instanceof Bounds) {|7f5a269b7e174256b2752ec84ba5fd4c|
min.y|bounds|if (obj instanceof Bounds) {|7f5a269b7e174256b2752ec84ba5fd4c|
max.y|bounds|if (obj instanceof Bounds) {|7f5a269b7e174256b2752ec84ba5fd4c|
min|this|else {|7f5a269b7e174256b2752ec84ba5fd4c|
max|this|else {|7f5a269b7e174256b2752ec84ba5fd4c|
min.x|min||7f5a269b7e174256b2752ec84ba5fd4c|
max.x|max||7f5a269b7e174256b2752ec84ba5fd4c|
min.y|min||7f5a269b7e174256b2752ec84ba5fd4c|
max.y|max||7f5a269b7e174256b2752ec84ba5fd4c|
this|min.x|return (min.x >= this.min.x)|7f5a269b7e174256b2752ec84ba5fd4c|
this|max.x|return (max.x <= this.max.x)|7f5a269b7e174256b2752ec84ba5fd4c|
this|min.y|return (min.y >= this.min.y)|7f5a269b7e174256b2752ec84ba5fd4c|
this|max.y|return (max.y <= this.max.y);|7f5a269b7e174256b2752ec84ba5fd4c|
latlngbounds|leaflet's class for representing a rectangular geographical area on a map.|LatLngBounds is a subclass of JavaScript object and does not inherit from Leaflet's Class object. This means new classes cannot inherit from LatLngBounds, and new methods cannot be added to it using the 'include' function.|09ed59f6a76549dba88a62d25156b144|
corner1|latlng or array of latlngs representing a corner coordinate pair.|Corner1 is an optional parameter for creating a new instance of LatLngBounds. If not specified, it returns null.|09ed59f6a76549dba88a62d25156b144|
corner2|latlng or array of latlngs representing the second corner coordinate pair.|Corner2 is an optional parameter for creating a new instance of LatLngBounds. If provided, it is used to create an array containing both corners.|09ed59f6a76549dba88a62d25156b144|
latlng|a class representing a single geographic position on a map.|LatLngBounds can accept either a single LatLng object or an array of LatLng objects to create a new instance.|09ed59f6a76549dba88a62d25156b144|
leaflet's method for accepting latlngbounds objects|method for fitting the map viewport within the bounds specified by the user.||09ed59f6a76549dba88a62d25156b144|
array form|simplified notation for passing latlngbounds objects to leaflet's methods.|Leaflet accepts both a LatLngBounds object and an array containing the coordinates of the corners in place of the LatLngBounds parameter.|09ed59f6a76549dba88a62d25156b144|
caution|note that if the geographic area spans across the antimeridian, it is recommended to specify the corners outside the [-180, 180] degrees longitude range.||09ed59f6a76549dba88a62d25156b144|
latlngbounds|this|The method 'extend' is called on the object 'LatLngBounds'|870e5fe2873b44d6a2cce924526fb158|
latlng|corner1|The variable 'corner1' is assigned a value of 'LatLng' in this context|870e5fe2873b44d6a2cce924526fb158|
latlngbounds|this|The method 'extend' is called on the object 'LatLngBounds' with 'corner1' as an argument|870e5fe2873b44d6a2cce924526fb158|
latlngbounds|this|The method 'extend' is called on the object 'LatLngBounds' with 'corner2' as an argument (if it exists)|870e5fe2873b44d6a2cce924526fb158|
latlng|sw2|The variable 'sw2' is assigned a value of 'LatLng' in this context|870e5fe2873b44d6a2cce924526fb158|
latlng|ne2|The variable 'ne2' is assigned a value of 'LatLng' in this context|870e5fe2873b44d6a2cce924526fb158|
latlngbounds|this|The method 'extend' is called on the object 'LatLngBounds' with 'sw2' and 'ne2' as arguments (if they exist)|870e5fe2873b44d6a2cce924526fb158|
latlngbounds|this|The variables '_southWest' and '_northEast' of the object 'LatLngBounds' are updated based on the results of the 'extend' method|870e5fe2873b44d6a2cce924526fb158|
string|bufferratio|The variable 'bufferRatio' is assigned a value of 'Number'|870e5fe2873b44d6a2cce924526fb158|
latlngbounds|this|The method 'pad' is called on the object 'LatLngBounds' with 'bufferRatio' as an argument|870e5fe2873b44d6a2cce924526fb158|
latlngbounds|sw|sw is a point within the bounds defined by LatLngBounds.|eac409f0ad5e4dc8b04b58321f2b1132|
latlngbounds|ne|ne is a point within the bounds defined by LatLngBounds.|eac409f0ad5e4dc8b04b58321f2b1132|
latlngbounds|heightbuffer|heightBuffer is used to determine the southern and northern boundaries of the bounds defined by LatLngBounds.|eac409f0ad5e4dc8b04b58321f2b1132|
latlngbounds|widthbuffer|widthBuffer is used to determine the western and eastern boundaries of the bounds defined by LatLngBounds.|eac409f0ad5e4dc8b04b58321f2b1132|
latlng|_southwest|is an instance of LatLng, which represents the south-west corner point of the bounds defined by LatLngBounds.|eac409f0ad5e4dc8b04b58321f2b1132|
latlng|_northeast|is an instance of LatLng, which represents the north-east corner point of the bounds defined by LatLngBounds.|eac409f0ad5e4dc8b04b58321f2b1132|
latlng|getnorthwest|returns a new LatLng instance with the same latitude as the north boundary and the same longitude as the west boundary of the bounds defined by LatLngBounds.|eac409f0ad5e4dc8b04b58321f2b1132|
latlng|getsoutheast|returns a new LatLng instance with the same latitude as the south boundary and the same longitude as the east boundary of the bounds defined by LatLngBounds.|eac409f0ad5e4dc8b04b58321f2b1132|
number|getwest|returns the longitude value of the western boundary point within the bounds defined by LatLngBounds.|eac409f0ad5e4dc8b04b58321f2b1132|
number|getsouth|returns the latitude value of the southern boundary point within the bounds defined by LatLngBounds.|eac409f0ad5e4dc8b04b58321f2b1132|
number|geteast|returns the longitude value of the eastern boundary point within the bounds defined by LatLngBounds.|eac409f0ad5e4dc8b04b58321f2b1132|
number|getnorth|returns the latitude value of the northern boundary point within the bounds defined by LatLngBounds.|eac409f0ad5e4dc8b04b58321f2b1132|
getnorth|number|Returns the north latitude of the bounds|9a25a79594a74d8792f9dc04d7cbda5d|
contains|latlngbounds|Returns `true` if the rectangle contains the given one.|9a25a79594a74d8792f9dc04d7cbda5d|
contains|latlng|Returns `true` if the rectangle contains the given point.|9a25a79594a74d8792f9dc04d7cbda5d|
intersects|latlngbounds|Returns `true` if the rectangle intersects the given bounds.|9a25a79594a74d8792f9dc04d7cbda5d|
latlngbounds|corner1|The first corner of a LatLngBounds object.|abcee6a95c6e4146a7892e804043a6ac|
latlngbounds|corner2|The second corner of a LatLngBounds object, diagonally opposite to the first one.|abcee6a95c6e4146a7892e804043a6ac|
latlngbounds|latlngs|An array containing the geographical points that define a LatLngBounds object.|abcee6a95c6e4146a7892e804043a6ac|
latlng|latlng|represents a geographical point with a certain latitude and longitude. Both LatLng objects can be passed as arguments to Leaflet methods that accept LatLng objects in Array or object forms, with equivalence between the two forms.|566ca1dc3b2c4aa08c534cefb70093c2|
latlng|lat|latitude in degrees is a property of LatLng objects.|566ca1dc3b2c4aa08c534cefb70093c2|
latlng|lng|longitude in degrees is a property of LatLng objects.|566ca1dc3b2c4aa08c534cefb70093c2|
latlng|alt|altitude in meters is an optional property that can be set for LatLng objects.|566ca1dc3b2c4aa08c534cefb70093c2|
latlng|point (for debugging purposes)|the `toString()` method returns a string representation of the point for debugging purposes.|ba66ca55fbfa4360b6c8b6a9ec89bea5|
distanceto|latlng|the `distanceTo()` method returns the distance (in meters) to another `LatLng` using the Spherical Law of Cosines and the `Earth.distance()` function.|ba66ca55fbfa4360b6c8b6a9ec89bea5|Earth.distance
wrap|latlng|the `wrap()` method returns a new `LatLng` with longitude wrapped between -180 and +180 degrees.|ba66ca55fbfa4360b6c8b6a9ec89bea5|
tobounds|latlng|the `toBounds()` method returns a new `LatLngBounds` object where each boundary is `sizeInMeters/2` meters apart from the `LatLng`.|ba66ca55fbfa4360b6c8b6a9ec89bea5|sizeInMeters
lataccuracy|lngaccuracy|these variables are used to calculate the latitude and longitude accuracy for wrapping and bounding calculations.|ba66ca55fbfa4360b6c8b6a9ec89bea5|
latlng|function () { return new latlng(this.lat, this.lng, this.alt); } |belongsToType|505a60ac0db64c2fb98417a6984a3149|
latlng|clone|isMethodOf|505a60ac0db64c2fb98417a6984a3149|
latlng|tolatlng|isFunctionThatTakesThreeArguments|505a60ac0db64c2fb98417a6984a3149|
latlng|coords|[{'node_1': 'Array', 'node_2': 'LatLng', 'edge': 'canBeConvertedTo'}, {'node_1': 'Object', 'node_2': 'LatLng', 'edge': 'canBeConvertedTo'}]|505a60ac0db64c2fb98417a6984a3149|
latlng|lat|hasProperty|505a60ac0db64c2fb98417a6984a3149|
latlng|lng|hasProperty|505a60ac0db64c2fb98417a6984a3149|
latlng|alt|hasOptionalProperty|505a60ac0db64c2fb98417a6984a3149|
node_1|node_2|edge|chunk_id
crs|latlng|The method 'latLngToPoint' in CRS class takes a LatLng object and a zoom value as input and returns a Point object representing the pixel coordinates of the given geographical location at the specified zoom level.|2faf26b318df417fb7530480dc6fa677
crs|point|The method 'pointToLatLng' in CRS class takes a Point object and a zoom value as input and returns a LatLng object representing the geographical location corresponding to the given pixel coordinates at the specified zoom level.|2faf26b318df417fb7530480dc6fa677
crs|projection|The 'latLngToPoint' and 'pointToLatLng' methods in CRS class use a projection object to convert between geographical and pixel coordinates.|2faf26b318df417fb7530480dc6fa677
crs|scale|The scale value is calculated based on the zoom level and used for coordinate conversions.|2faf26b318df417fb7530480dc6fa677
crs|transformation|The 'transform' and 'untransform' methods in CRS class use a transformation object to convert between screen coordinates and geographical coordinates.|2faf26b318df417fb7530480dc6fa677
project|latlng|The `project` method in the class takes a `LatLng` as input and returns a point according to the CRS (Coordinate Reference System) of this projection.|1518435421f74679a2d6c47e95b9ea92
projection|unproject|The `unproject` method in the class is the inverse of the `project` method and takes a point as input and returns a `LatLng`.|1518435421f74679a2d6c47e95b9ea92
projection|bounds|The `getProjectedBounds` method in the class returns the projection's bounds scaled and transformed for the provided `zoom`.|1518435421f74679a2d6c47e95b9ea92
projection|infinite|If the `infinite` property is true, then the method `getProjectedBounds` returns null.|1518435421f74679a2d6c47e95b9ea92
projection|transformation|The `transform` function in the class transforms coordinates from one CRS to another, and is used by the `getProjectedBounds` method.|1518435421f74679a2d6c47e95b9ea92
zoom|scale|The `scale` method returns the scale used when transforming projected coordinates into pixel coordinates for a particular zoom, and is inversely related to the `zoom` level.|1518435421f74679a2d6c47e95b9ea92
distance|latlng|Returns the distance between two geographical coordinates represented by LatLng objects.|e7f226b489574650bf1ef4d60ce13442
